{
  "schemaVersion": 1,
  "path": "app/services/billing.py",
  "blobHash": "c33ad830db7326b15a6477cb1558b0a7d1d0098436c6be7a1d91944d5a0c7834",
  "summary": "Lógica de facturación: suma importes y construye una [[ref:app/models.py#Invoice]]. Ahora\ntiene **dos operaciones simétricas**: `process` factura y `refund` reembolsa, y ambas usan el\nmismo modelo. El cálculo (`compute_total`) sigue separado de la construcción del modelo.",
  "blocks": [
    {
      "id": "b1",
      "range": [
        1,
        1
      ],
      "title": "Dependencia del modelo",
      "body": "Importa la clase `Invoice` directamente (a diferencia de `main.py`, que importa módulos).\nAquí no hay conflicto de nombres, así que la forma corta es la más legible."
    },
    {
      "id": "b2",
      "range": [
        4,
        5
      ],
      "title": "compute_total(): el cálculo puro",
      "body": "`sum(items)` sobre enteros. Que sea una función aparte, aunque sea de una línea, deja un punto\núnico donde añadir impuestos o descuentos sin tocar `process`. Con importes en coma flotante\nconvendría `decimal.Decimal`; el esquema SQL usa `INTEGER` para `total`\n([[ref:db/schema.sql:L9]]), lo que sugiere importes en unidades enteras (p. ej. céntimos)."
    },
    {
      "id": "b3",
      "range": [
        8,
        10
      ],
      "title": "process(): de usuario e importes a total",
      "body": "Construye la factura con el nombre del usuario y el total calculado, y **devuelve solo el\ntotal**: el objeto `Invoice` se crea y se descarta en la misma función.\n\n```mermaid\nflowchart LR\n    U[\"user dict\"] -->|\"user['name']\"| I[\"Invoice(owner, total)\"]\n    L[\"items\"] --> C[\"compute_total\"] -->|\"sum\"| I\n    I -->|\".total\"| R((\"return\"))\n```\n\n¿Por qué crear el objeto si se tira? Porque el modelo es el lugar natural para crecer\n(guardar la factura, emitir un evento, validar). Hoy es un paso intermedio; el contrato público\nde la función es \"dame un usuario e importes y te doy el total\"."
    },
    {
      "id": "b4",
      "range": [
        13,
        15
      ],
      "title": "refund(): un reembolso es una factura negativa",
      "body": "En lugar de crear un modelo `Refund`, el reembolso se representa como una\n[[ref:app/models.py#Invoice]] con total **negativo** (`-amount`). Es la decisión de diseño\ncentral del cambio, y tiene consecuencias:\n\n- **Ventaja**: no hay modelo nuevo; sumar todas las facturas de un usuario da directamente su\n  saldo neto. La tabla `invoices` ([[ref:db/schema.sql#invoices]]) no tiene `CHECK` que lo impida.\n- **Coste**: el signo es la única marca de que algo es un reembolso; `amount` negativo\n  produciría un \"reembolso\" positivo y nada lo valida.\n\nCompárala con [[ref:app/services/billing.py#process]] (líneas\n[[ref:app/services/billing.py:L8-10]]): mismo esqueleto, pero `refund` recibe un importe ya\ncalculado en vez de una lista, así que no pasa por `compute_total`."
    }
  ]
}
